{"$id":"urn:skippercast:coast-enqueue-receipt-v1","$schema":"https://json-schema.org/draft/2020-12/schema","additionalProperties":false,"properties":{"admission":{"additionalProperties":false,"properties":{"bytes":{"minimum":0,"type":"integer"},"path":{"minLength":1,"pattern":"^(?!/)(?!.*\\\\)(?!.*(?:^|/)\\.{1,2}(?:/|$))(?!.*//)[^\\u0000-\\u001f]+$","type":"string"},"root_id":{"pattern":"(?:queue:[A-Za-z0-9_-]+|repo:[0-9a-f]{40}|archive:[A-Za-z0-9_-]+:[A-Za-z0-9_-]+|raw:campaign)$","type":"string"},"sha256":{"pattern":"^[0-9a-f]{64}$","type":"string"}},"required":["root_id","path","sha256","bytes"],"type":"object"},"author_model":{"minLength":1,"type":"string"},"author_profile":{"minLength":1,"type":"string"},"bridge":{"additionalProperties":false,"properties":{"bytes":{"minimum":0,"type":"integer"},"path":{"minLength":1,"pattern":"^(?!/)(?!.*\\\\)(?!.*(?:^|/)\\.{1,2}(?:/|$))(?!.*//)[^\\u0000-\\u001f]+$","type":"string"},"root_id":{"pattern":"(?:queue:[A-Za-z0-9_-]+|repo:[0-9a-f]{40}|archive:[A-Za-z0-9_-]+:[A-Za-z0-9_-]+|raw:campaign)$","type":"string"},"sha256":{"pattern":"^[0-9a-f]{64}$","type":"string"}},"required":["root_id","path","sha256","bytes"],"type":"object"},"campaign_segment_id":{"pattern":"^[A-Za-z0-9_-]+$","type":"string"},"card_id":{"pattern":"^t_[0-9a-f]{8}$","type":"string"},"code_commit":{"pattern":"^[0-9a-f]{40}$","type":"string"},"code_sha256":{"pattern":"^[0-9a-f]{64}$","type":"string"},"coordinator_segment_id":{"pattern":"^seg:3310:-?[0-9]+:-?[0-9]+:5000$","type":"string"},"created_utc":{"format":"date-time","pattern":"Z$","type":"string"},"deps_sha256":{"pattern":"^[0-9a-f]{64}$","type":"string"},"intent":{"additionalProperties":false,"properties":{"bytes":{"minimum":0,"type":"integer"},"path":{"minLength":1,"pattern":"^(?!/)(?!.*\\\\)(?!.*(?:^|/)\\.{1,2}(?:/|$))(?!.*//)[^\\u0000-\\u001f]+$","type":"string"},"root_id":{"pattern":"(?:queue:[A-Za-z0-9_-]+|repo:[0-9a-f]{40}|archive:[A-Za-z0-9_-]+:[A-Za-z0-9_-]+|raw:campaign)$","type":"string"},"sha256":{"pattern":"^[0-9a-f]{64}$","type":"string"}},"required":["root_id","path","sha256","bytes"],"type":"object"},"jobs":{"items":{"additionalProperties":false,"properties":{"input_manifest":{"additionalProperties":false,"properties":{"bytes":{"minimum":0,"type":"integer"},"path":{"minLength":1,"pattern":"^(?!/)(?!.*\\\\)(?!.*(?:^|/)\\.{1,2}(?:/|$))(?!.*//)[^\\u0000-\\u001f]+$","type":"string"},"root_id":{"pattern":"(?:queue:[A-Za-z0-9_-]+|repo:[0-9a-f]{40}|archive:[A-Za-z0-9_-]+:[A-Za-z0-9_-]+|raw:campaign)$","type":"string"},"sha256":{"pattern":"^[0-9a-f]{64}$","type":"string"}},"required":["root_id","path","sha256","bytes"],"type":"object"},"new_row":{"type":"boolean"},"root_job_id":{"minLength":1,"type":"string"},"source_id":{"minLength":1,"type":"string"},"window_key":{"minLength":1,"type":"string"}},"required":["window_key","source_id","root_job_id","input_manifest","new_row"],"type":"object"},"minItems":1,"type":"array"},"plan_id":{"pattern":"^[A-Za-z0-9_-]+$","type":"string"},"plan_sha256":{"pattern":"^[0-9a-f]{64}$","type":"string"},"schema":{"enum":["coast-enqueue-receipt-v1"]},"skill_commit":{"pattern":"^[0-9a-f]{40}$","type":"string"},"store_path":{"enum":["var/coastal/coordinator.sqlite"]}},"required":["schema","created_utc","author_profile","author_model","card_id","code_commit","skill_commit","campaign_segment_id","coordinator_segment_id","plan_id","plan_sha256","admission","bridge","code_sha256","deps_sha256","store_path","intent","jobs"],"type":"object"}
