{"admission":{"bytes":3301,"path":"valid/admission.json","root_id":"queue:synthetic","sha256":"790e582f9f03de1ea4c956b4f270d3889413f6c2bb57bba4853495d848f9e6cb"},"author_model":"synthetic-author","author_profile":"fixture","bridge":{"bytes":62,"path":"provenance/synthetic.txt","root_id":"queue:synthetic","sha256":"f91717194ed7a83fa6973235c3562fa0e1276fea4ed49bbc7f8e1f145b03a4f6"},"campaign_segment_id":"synthetic","card_id":"t_366d24e2","code_commit":"1111111111111111111111111111111111111111","code_sha256":"f91717194ed7a83fa6973235c3562fa0e1276fea4ed49bbc7f8e1f145b03a4f6","coordinator_segment_id":"seg:3310:-55000:-400000:5000","created_utc":"2026-10-21T00:00:00Z","deps_sha256":"f91717194ed7a83fa6973235c3562fa0e1276fea4ed49bbc7f8e1f145b03a4f6","intent":{"bytes":62,"path":"provenance/synthetic.txt","root_id":"queue:synthetic","sha256":"f91717194ed7a83fa6973235c3562fa0e1276fea4ed49bbc7f8e1f145b03a4f6"},"jobs":[{"input_manifest":{"bytes":62,"path":"provenance/synthetic.txt","root_id":"queue:synthetic","sha256":"f91717194ed7a83fa6973235c3562fa0e1276fea4ed49bbc7f8e1f145b03a4f6"},"new_row":true,"root_job_id":"synthetic-root","source_id":"source/a","window_key":"ncei:input.bag#02cc2c8f24a38b615e4e44ea455bc19b7bc95e9a6baa9f2508a9b0a4eacf87b0#0"}],"plan_id":"plan01","plan_sha256":"bc8e63c824c022674041134139ae5a6f6403dd427c18fd56cd0e95ab4615875a","schema":"coast-enqueue-receipt-v1","skill_commit":"2222222222222222222222222222222222222222","store_path":"var/coastal/coordinator.sqlite"}
